{
  "$schema": "https://json-schema.org/draft/2020-12/schema",
  "$id": "https://github.com/robit-man/qwen-omni-adapters/blob/main/docs/schema/voice-profile-v1.schema.json",
  "title": "Robit Omni Qwen3-TTS voice profile v1",
  "type": "object",
  "required": ["schema", "language"],
  "properties": {
    "schema": {"const": "robit.omni.voice-profile.v1"},
    "name": {"type": "string", "minLength": 1},
    "language": {
      "type": "string",
      "enum": ["zh", "en", "de", "it", "pt", "es", "ja", "ko", "fr", "ru"]
    },
    "locale": {
      "type": "string",
      "pattern": "^[A-Za-z]{2}(?:-[A-Za-z0-9]{2,8})*$",
      "description": "Optional BCP 47 regional override whose primary language must match language."
    },
    "speaker_file": {
      "type": "string",
      "description": "Server-local WAV/MP3 reference; relative paths resolve from the profile file."
    },
    "reference_text": {"type": "string", "maxLength": 2048, "pattern": "^[^\\u0000]*$", "description": "Optional transcript belonging to this reference; blank preserves speaker-embedding conditioning."},
    "presets": {
      "type": "array",
      "minItems": 1,
      "uniqueItems": true,
      "items": {
        "type": "object",
        "required": ["id", "label", "speaker_file", "default"],
        "properties": {
          "id": {"type": "string", "pattern": "^[A-Za-z0-9_-]{1,64}$"},
          "label": {"type": "string", "minLength": 1, "maxLength": 80},
          "speaker_file": {"type": "string", "minLength": 1},
          "reference_text": {"type": "string", "maxLength": 2048, "pattern": "^[^\\u0000]*$"},
          "default": {"type": "boolean"}
        },
        "additionalProperties": false
      },
      "description": "Server-allowlisted clone references; runtime validation requires exactly one default."
    },
    "temperature": {"type": "number", "minimum": 0, "maximum": 2},
    "top_k": {"type": "integer", "minimum": 0, "maximum": 1000},
    "top_p": {"type": "number", "minimum": 0, "maximum": 1},
    "seed": {"type": "integer", "minimum": -1, "maximum": 2147483647},
    "max_frames": {
      "type": "integer",
      "minimum": 1,
      "maximum": 2048,
      "description": "Maximum codec frames for each bounded synthesis block."
    }
  },
  "additionalProperties": false
}
