{
  "schema": "robit.omni.voice-profile.v1",
  "name": "default",
  "language": "en",
  "locale": "en-US",
  "speaker_file": "voices/female_voice.wav",
  "reference_text": "",
  "presets": [
    {
      "id": "female",
      "label": "Female",
      "speaker_file": "voices/female_voice.wav",
      "default": true
    },
    {
      "id": "male",
      "label": "Male",
      "speaker_file": "voices/default_voice.wav",
      "default": false
    }
  ],
  "temperature": 0.7,
  "top_k": 40,
  "top_p": 0.9,
  "seed": 42,
  "max_frames": 512
}
